{
  "screenId":"qna-answer-detail","screenVersion":2,"screenSpecificationId":"qna-suite","screenSpecificationVersion":2,
  "screenType":"DETAIL","layoutPattern":"STANDARD","name":"답변 상세","route":"/qna/answers/{id}","viewport":"DESKTOP","status":"REVIEW_REQUIRED",
  "designSystem":{"profileId":"krds","profileVersion":"2.0.0","registryVersion":"2.1.0"},
  "content":{"logicalNodeId":"qna-answer-detail","nodeType":"PAGE","type":"egov.detailPage","properties":{},"children":[
    {"logicalNodeId":"qna-answer-detail/header","nodeType":"COMPONENT","type":"krds.pageHeader","properties":{"semanticRole":"page.header","title":"답변 상세"},"componentResolution":{"role":"page.header","logicalType":"krds.pageHeader","componentSetKey":"18b8d3ffdbc9d4824e0d756e87a8f7af684ae980","variantKey":"18b8d3ffdbc9d4824e0d756e87a8f7af684ae980","variantProperties":{},"componentProperties":{"Title#259:4":"답변 상세"},"contractVersion":"2.1.0","ruleSetVersion":"2.0.0-candidate","ruleId":null,"contextHash":"c0db966ca94188d17bb3435fb698ae0b28c4965efad6676a4a56d64daa658c31"},"children":[]},
    {"logicalNodeId":"qna-answer-detail/form","nodeType":"SECTION","type":"egov.formSection","properties":{"semanticRole":"form.section"},"children":[
      {"logicalNodeId":"qna-answer-detail/writer","nodeType":"COMPONENT","type":"krds.textField","properties":{"semanticRole":"field.text","label":"답변자","mode":"READ_ONLY"},"componentResolution":{"role":"field.text","logicalType":"krds.textField","componentSetKey":"e2643d821fe50580f30fd5d0378ad7e486543da6","variantKey":"70b0b3a31a84cc0ddc9e7e25fb820fed829dcb51","variantProperties":{"Size":"medium","State":"view"},"componentProperties":{"↪️Label#286:10":"답변자","Placeholder#286:9":"관리자"},"contractVersion":"2.1.0","ruleSetVersion":"2.0.0-candidate","ruleId":"text-readonly","contextHash":"221820589b11b522128a386de0e38a19d339c3382b14fa6993bb211ffe40866e"},"children":[]},
      {"logicalNodeId":"qna-answer-detail/content","nodeType":"COMPONENT","type":"krds.textarea","properties":{"semanticRole":"field.textarea","label":"답변 내용","mode":"READ_ONLY"},"componentResolution":{"role":"field.textarea","logicalType":"krds.textarea","componentSetKey":"f49c48fc96dc5454fa59f17cc937a87a9f986ba6","variantKey":"7f943e02f1d0ea140be2185ced5505b9eedb9d3b","variantProperties":{"State":"view"},"componentProperties":{"Label#286:10":"답변 내용","Placeholder#286:9":"등록된 답변 내용"},"contractVersion":"2.1.0","ruleSetVersion":"2.0.0-candidate","ruleId":"textarea-readonly","contextHash":"aa45ee59d2e77eb75509320888cdc1f8c06dd87b41e885115b46424a75d10cc9"},"children":[]}
    ]},
    {"logicalNodeId":"qna-answer-detail/actions","nodeType":"SECTION","type":"egov.actionArea","properties":{},"children":[
      {"logicalNodeId":"qna-answer-detail/action/reply","nodeType":"COMPONENT","type":"krds.button","properties":{"semanticRole":"action.primary","label":"답변 등록","state":"DEFAULT"},"componentResolution":{"role":"action.primary","logicalType":"krds.button","componentSetKey":"104d078e1895f788a91cfc8c42073fe6bc85e77a","variantKey":"e280ccbaae3e95099a298e208126f5abbff2f730","variantProperties":{"Type":"primary","Size":"medium","State":"default"},"componentProperties":{"Label#300:3":"답변 등록"},"contractVersion":"2.1.0","ruleSetVersion":"2.0.0-candidate","ruleId":"action-primary","contextHash":"5642ce851ec766291b49b015ceeaac66c35b9adcc8f0fe7ad3f084173e830558"},"children":[]},
      {"logicalNodeId":"qna-answer-detail/action/list","nodeType":"COMPONENT","type":"krds.button","properties":{"semanticRole":"action.secondary","label":"목록","state":"DEFAULT"},"componentResolution":{"role":"action.secondary","logicalType":"krds.button","componentSetKey":"104d078e1895f788a91cfc8c42073fe6bc85e77a","variantKey":"189eeeae1c3236f83674729b1e2f6873e44e2386","variantProperties":{"Type":"secondary","Size":"medium","State":"default"},"componentProperties":{"Label#300:3":"목록"},"contractVersion":"2.1.0","ruleSetVersion":"2.0.0-candidate","ruleId":"action-secondary","contextHash":"316333be4583173a4fa74adeadff109274a6f4864203c97ba05cdadfcf833416"},"children":[]}
    ]}
  ]},
  "issues":[],"semanticPattern":"crud.detail","screenPatternVersion":"1.0.0","variantRuleSetVersion":"2.0.0-candidate","componentContractVersion":"2.1.0"
}
