{
  "screenId":"qna-detail","screenVersion":2,"screenSpecificationId":"qna-suite","screenSpecificationVersion":2,
  "screenType":"DETAIL","layoutPattern":"STANDARD","name":"Q&A 상세","route":"/qna/{id}","viewport":"DESKTOP","status":"REVIEW_REQUIRED",
  "designSystem":{"profileId":"krds","profileVersion":"2.0.0","registryVersion":"2.2.0"},
  "content":{"logicalNodeId":"qna-detail","nodeType":"PAGE","type":"egov.detailPage","properties":{},"children":[
    {"logicalNodeId":"qna-detail/header","nodeType":"COMPONENT","type":"krds.pageHeader","properties":{"semanticRole":"page.header","title":"질문 상세"},"componentResolution":{"role":"page.header","logicalType":"krds.pageHeader","componentSetKey":"18b8d3ffdbc9d4824e0d756e87a8f7af684ae980","variantKey":"18b8d3ffdbc9d4824e0d756e87a8f7af684ae980","variantProperties":{},"componentProperties":{"Title#259:4":"질문 상세"},"contractVersion":"2.1.0","ruleSetVersion":"2.2.0-candidate","ruleId":null,"contextHash":"1122b0c1cc77933741a07f6c01424e0bf3f6c160e52bf7a92cc05042f93c790a"},"children":[]},
    {"logicalNodeId":"qna-detail/form","nodeType":"SECTION","type":"egov.formSection","properties":{"semanticRole":"form.section"},"children":[
      {"logicalNodeId":"qna-detail/writer","nodeType":"COMPONENT","type":"krds.textField","properties":{"semanticRole":"field.text","label":"작성자","mode":"READ_ONLY"},"componentResolution":{"role":"field.text","logicalType":"krds.textField","componentSetKey":"e2643d821fe50580f30fd5d0378ad7e486543da6","variantKey":"70b0b3a31a84cc0ddc9e7e25fb820fed829dcb51","variantProperties":{"Size":"medium","State":"view"},"componentProperties":{"↪️Label#286:10":"작성자","Placeholder#286:9":"홍길동"},"contractVersion":"2.1.0","ruleSetVersion":"2.2.0-candidate","ruleId":"text-readonly","contextHash":"afb324841055bb1cb2db1c0a53485fb6323dd2274a1448be80c683ef83370e07"},"children":[]},
      {"logicalNodeId":"qna-detail/content","nodeType":"COMPONENT","type":"krds.textarea","properties":{"semanticRole":"field.textarea","label":"질문 내용","mode":"READ_ONLY"},"componentResolution":{"role":"field.textarea","logicalType":"krds.textarea","componentSetKey":"f49c48fc96dc5454fa59f17cc937a87a9f986ba6","variantKey":"7f943e02f1d0ea140be2185ced5505b9eedb9d3b","variantProperties":{"State":"view"},"componentProperties":{"Label#286:10":"질문 내용","Placeholder#286:9":"등록된 질문 내용"},"contractVersion":"2.1.0","ruleSetVersion":"2.2.0-candidate","ruleId":"textarea-readonly","contextHash":"daa1454cf0efb6149cc19412a962cc0841c4e4ec566e43f9c892db8fdf2ff895"},"children":[]}
    ]},
    {"logicalNodeId":"qna-detail/actions","nodeType":"SECTION","type":"egov.actionArea","properties":{},"children":[
      {"logicalNodeId":"qna-detail/action/update","nodeType":"COMPONENT","type":"krds.button","properties":{"semanticRole":"action.primary","label":"수정","state":"DEFAULT"},"componentResolution":{"role":"action.primary","logicalType":"krds.button","componentSetKey":"104d078e1895f788a91cfc8c42073fe6bc85e77a","variantKey":"e280ccbaae3e95099a298e208126f5abbff2f730","variantProperties":{"Type":"primary","Size":"medium","State":"default"},"componentProperties":{"Label#300:3":"수정"},"contractVersion":"2.1.0","ruleSetVersion":"2.2.0-candidate","ruleId":"action-primary","contextHash":"4c64625603fbcaf5fe071388f98c0e8be43ea54ada41feab781b51c3bdabfcc5"},"children":[]},
      {"logicalNodeId":"qna-detail/action/delete","nodeType":"COMPONENT","type":"krds.button","properties":{"semanticRole":"action.destructive","label":"삭제","state":"DEFAULT"},"componentResolution":{"role":"action.destructive","logicalType":"krds.button","componentSetKey":"104d078e1895f788a91cfc8c42073fe6bc85e77a","variantKey":"c256f2b3dec80952e543d62f93a892bb2c0cb2e7","variantProperties":{"Type":"tertiary","Size":"medium","State":"default"},"componentProperties":{"Label#300:3":"삭제"},"contractVersion":"2.1.0","ruleSetVersion":"2.2.0-candidate","ruleId":"action-destructive","contextHash":"b3c7cfe9a632fa04a3c1e1252ec0d8dd2f0f7428bc925ac264a4dc646b5458c6"},"children":[]},
      {"logicalNodeId":"qna-detail/action/list","nodeType":"COMPONENT","type":"krds.button","properties":{"semanticRole":"action.secondary","label":"목록","state":"DEFAULT"},"componentResolution":{"role":"action.secondary","logicalType":"krds.button","componentSetKey":"104d078e1895f788a91cfc8c42073fe6bc85e77a","variantKey":"189eeeae1c3236f83674729b1e2f6873e44e2386","variantProperties":{"Type":"secondary","Size":"medium","State":"default"},"componentProperties":{"Label#300:3":"목록"},"contractVersion":"2.1.0","ruleSetVersion":"2.2.0-candidate","ruleId":"action-secondary","contextHash":"7cef8700bda7ce3cf850996e013c33c74bf21ba15d684846866343c759956e81"},"children":[]}
    ]}
  ]},
  "issues":[],"semanticPattern":"crud.detail","screenPatternVersion":"1.0.0","variantRuleSetVersion":"2.2.0-candidate","componentContractVersion":"2.1.0"
}
