{
  "screenId":"qna-list","screenVersion":2,"screenSpecificationId":"qna-suite","screenSpecificationVersion":2,
  "screenType":"LIST","layoutPattern":"STANDARD","name":"Q&A 목록","route":"/qna","viewport":"DESKTOP","status":"REVIEW_REQUIRED",
  "designSystem":{"profileId":"krds","profileVersion":"2.0.0","registryVersion":"2.1.0"},
  "content":{"logicalNodeId":"qna-list","nodeType":"PAGE","type":"egov.listPage","properties":{},"children":[
    {"logicalNodeId":"qna-list/header","nodeType":"COMPONENT","type":"krds.pageHeader","properties":{"semanticRole":"page.header","title":"질문과 답변"},"componentResolution":{"role":"page.header","logicalType":"krds.pageHeader","componentSetKey":"18b8d3ffdbc9d4824e0d756e87a8f7af684ae980","variantKey":"18b8d3ffdbc9d4824e0d756e87a8f7af684ae980","variantProperties":{},"componentProperties":{"Title#259:4":"질문과 답변"},"contractVersion":"2.1.0","ruleSetVersion":"2.0.0-candidate","ruleId":null,"contextHash":"49029d3e301e9bb21aec5c6ef7acde45fb781a0f3ec72818001a2886e8b86f69"},"children":[]},
    {"logicalNodeId":"qna-list/search","nodeType":"COMPONENT","type":"krds.searchPanel","properties":{"semanticRole":"search.panel","fieldCount":2,"searchFieldIds":["keyword","status"],"label":"검색어","placeholder":"검색어를 입력하세요"},"componentResolution":{"role":"search.panel","logicalType":"krds.searchPanel","componentSetKey":"53fbd1d332750b3f631bdd7330ebc0a73f389afe","variantKey":"f2ca6ba8381fa38c0a6bdc24bea228cf55623bec","variantProperties":{"Size":"medium","State":"default"},"componentProperties":{"Lable#723:0":"검색어","↪️Hint#1275:39":"검색어를 입력하세요"},"contractVersion":"2.1.0","ruleSetVersion":"2.0.0-candidate","ruleId":"search-panel-default","contextHash":"45913ee46f160b819c23ad01e060a37bc147b5b8c7f9a77255b180dbe591dc37"},"children":[]},
    {"logicalNodeId":"qna-list/table-region","nodeType":"SECTION","type":"egov.dataTable","properties":{"semanticRole":"data.table"},"children":[
      {"logicalNodeId":"qna-list/table-cell","nodeType":"COMPONENT","type":"krds.tableCell","properties":{"semanticRole":"data.table.cell","label":"질문 제목"},"componentResolution":{"role":"data.table.cell","logicalType":"krds.tableCell","componentSetKey":"194a582dc105671593355376a992d90ab42ca7ce","variantKey":"5e56406b21518d3ae03b4f77f69e4c8849da290b","variantProperties":{"Type":"body"},"componentProperties":{"Body#288:22":"질문 제목"},"contractVersion":"2.1.0","ruleSetVersion":"2.0.0-candidate","ruleId":"table-cell-body","contextHash":"ed698d8cf848a999bfcb9906dd4d8ca33f883edc0897572561442944c238f312"},"children":[]}
    ]},
    {"logicalNodeId":"qna-list/pagination","nodeType":"COMPONENT","type":"krds.pagination","properties":{"semanticRole":"data.pagination"},"componentResolution":{"role":"data.pagination","logicalType":"krds.pagination","componentSetKey":"0bd34989017991e94c73147e823ef53a6aaac39f","variantKey":"0bd34989017991e94c73147e823ef53a6aaac39f","variantProperties":{},"componentProperties":{},"contractVersion":"2.1.0","ruleSetVersion":"2.0.0-candidate","ruleId":null,"contextHash":"de3f3202e12f01a2f0f498629f48947781ae845c26007f8e8fb5b8c8ae2af31c"},"children":[]},
    {"logicalNodeId":"qna-list/action/create","nodeType":"COMPONENT","type":"krds.button","properties":{"semanticRole":"action.primary","label":"등록","state":"DEFAULT"},"componentResolution":{"role":"action.primary","logicalType":"krds.button","componentSetKey":"104d078e1895f788a91cfc8c42073fe6bc85e77a","variantKey":"e280ccbaae3e95099a298e208126f5abbff2f730","variantProperties":{"Type":"primary","Size":"medium","State":"default"},"componentProperties":{"Label#300:3":"등록"},"contractVersion":"2.1.0","ruleSetVersion":"2.0.0-candidate","ruleId":"action-primary","contextHash":"45fe26dab44d1fc92e3b05d6ea5c4cec964a76a2dd40852c013609d3c3b338cd"},"children":[]}
  ]},
  "issues":[],"semanticPattern":"crud.list","screenPatternVersion":"1.0.0","variantRuleSetVersion":"2.0.0-candidate","componentContractVersion":"2.1.0"
}
