{
  "screenId":"qna-answer-list","screenVersion":2,"screenSpecificationId":"qna-suite","screenSpecificationVersion":2,
  "screenType":"LIST","layoutPattern":"STANDARD","name":"답변 목록","route":"/qna/answers","viewport":"DESKTOP","status":"REVIEW_REQUIRED",
  "designSystem":{"profileId":"krds","profileVersion":"2.0.0","registryVersion":"2.2.0"},
  "content":{"logicalNodeId":"qna-answer-list","nodeType":"PAGE","type":"egov.listPage","properties":{},"children":[
    {"logicalNodeId":"qna-answer-list/header","nodeType":"COMPONENT","type":"krds.pageHeader","properties":{"semanticRole":"page.header","title":"답변 목록"},"componentResolution":{"role":"page.header","logicalType":"krds.pageHeader","componentSetKey":"18b8d3ffdbc9d4824e0d756e87a8f7af684ae980","variantKey":"18b8d3ffdbc9d4824e0d756e87a8f7af684ae980","variantProperties":{},"componentProperties":{"Title#259:4":"답변 목록"},"contractVersion":"2.1.0","ruleSetVersion":"2.2.0-candidate","ruleId":null,"contextHash":"593fd0e512439b491049b35170ace4d37bdd64718b0adbb338a3fa0257bb5968"},"children":[]},
    {"logicalNodeId":"qna-answer-list/search","nodeType":"COMPONENT","type":"krds.searchPanel","properties":{"semanticRole":"search.panel","fieldCount":1,"searchFieldIds":["keyword"],"label":"검색어","placeholder":"질문 또는 답변을 검색하세요"},"componentResolution":{"role":"search.panel","logicalType":"krds.searchPanel","componentSetKey":"53fbd1d332750b3f631bdd7330ebc0a73f389afe","variantKey":"f2ca6ba8381fa38c0a6bdc24bea228cf55623bec","variantProperties":{"Size":"medium","State":"default"},"componentProperties":{"Lable#723:0":"검색어","↪️Hint#1275:39":"질문 또는 답변을 검색하세요"},"contractVersion":"2.1.0","ruleSetVersion":"2.2.0-candidate","ruleId":"search-panel-default","contextHash":"bcef9ef35ac9a089e52249687708a9f80f04ce4960a3073acfeb4cfc240138c4"},"children":[]},
    {"logicalNodeId":"qna-answer-list/table-region","nodeType":"SECTION","type":"egov.dataTable","properties":{"semanticRole":"data.table"},"children":[
      {"logicalNodeId":"qna-answer-list/table-cell","nodeType":"COMPONENT","type":"krds.tableCell","properties":{"semanticRole":"data.table.cell","label":"답변 제목"},"componentResolution":{"role":"data.table.cell","logicalType":"krds.tableCell","componentSetKey":"194a582dc105671593355376a992d90ab42ca7ce","variantKey":"5e56406b21518d3ae03b4f77f69e4c8849da290b","variantProperties":{"Type":"body"},"componentProperties":{"Body#288:22":"답변 제목"},"contractVersion":"2.1.0","ruleSetVersion":"2.2.0-candidate","ruleId":"table-cell-body","contextHash":"2d57a8c48be765f2fe7bb3e5d9c017c7ca9c9515ad5d211850ff901736c05377"},"children":[]}
    ]},
    {"logicalNodeId":"qna-answer-list/pagination","nodeType":"COMPONENT","type":"krds.pagination","properties":{"semanticRole":"data.pagination"},"componentResolution":{"role":"data.pagination","logicalType":"krds.pagination","componentSetKey":"0bd34989017991e94c73147e823ef53a6aaac39f","variantKey":"0bd34989017991e94c73147e823ef53a6aaac39f","variantProperties":{},"componentProperties":{},"contractVersion":"2.1.0","ruleSetVersion":"2.2.0-candidate","ruleId":null,"contextHash":"cf51046f871b28b63bfd94824286961ce489163f41ca9670c67b9b77cb1d7116"},"children":[]}
  ]},
  "issues":[],"semanticPattern":"crud.list","screenPatternVersion":"1.0.0","variantRuleSetVersion":"2.2.0-candidate","componentContractVersion":"2.1.0"
}
