{
  "screenId":"qna-create","screenVersion":2,"screenSpecificationId":"qna-suite","screenSpecificationVersion":2,
  "screenType":"FORM","layoutPattern":"STANDARD","name":"Q&A 등록","route":"/qna/new","viewport":"DESKTOP","status":"REVIEW_REQUIRED",
  "designSystem":{"profileId":"krds","profileVersion":"2.0.0","registryVersion":"2.2.0"},
  "content":{"logicalNodeId":"qna-create","nodeType":"PAGE","type":"egov.formPage","properties":{},"children":[
    {"logicalNodeId":"qna-create/header","nodeType":"COMPONENT","type":"krds.pageHeader","properties":{"semanticRole":"page.header","title":"질문 등록"},"componentResolution":{"role":"page.header","logicalType":"krds.pageHeader","componentSetKey":"18b8d3ffdbc9d4824e0d756e87a8f7af684ae980","variantKey":"18b8d3ffdbc9d4824e0d756e87a8f7af684ae980","variantProperties":{},"componentProperties":{"Title#259:4":"질문 등록"},"contractVersion":"2.1.0","ruleSetVersion":"2.2.0-candidate","ruleId":null,"contextHash":"c5fa0cfe7188f626064bf5c4a6a0046d35fb7cfa09386b5a3b1d11d2a2d90e4f"},"children":[]},
    {"logicalNodeId":"qna-create/form-container","nodeType":"SECTION","type":"egov.formContainer","properties":{"semanticRole":"form.container"},"children":[
    {"logicalNodeId":"qna-create/form","nodeType":"SECTION","type":"egov.formSection","properties":{"semanticRole":"form.section"},"children":[
      {"logicalNodeId":"qna-create/writer","nodeType":"COMPONENT","type":"krds.textField","properties":{"semanticRole":"field.text","label":"작성자","mode":"EDITABLE"},"componentResolution":{"role":"field.text","logicalType":"krds.textField","componentSetKey":"e2643d821fe50580f30fd5d0378ad7e486543da6","variantKey":"f5e5a8b6e88dc45eb7357bd59c829c44bc47a198","variantProperties":{"Size":"medium","State":"default"},"componentProperties":{"↪️Label#286:10":"작성자","Placeholder#286:9":"작성자명을 입력하세요"},"contractVersion":"2.1.0","ruleSetVersion":"2.2.0-candidate","ruleId":"text-editable","contextHash":"1451777991b78ca46e3ff780c3229d0928c2bbee63ef9da0adea42b07f52b69b"},"children":[]},
      {"logicalNodeId":"qna-create/content","nodeType":"COMPONENT","type":"krds.textarea","properties":{"semanticRole":"field.textarea","label":"질문 내용","mode":"EDITABLE"},"componentResolution":{"role":"field.textarea","logicalType":"krds.textarea","componentSetKey":"f49c48fc96dc5454fa59f17cc937a87a9f986ba6","variantKey":"14b0380446ab18714fad10cfd534f5121db21961","variantProperties":{"State":"default"},"componentProperties":{"Label#286:10":"질문 내용","Placeholder#286:9":"질문 내용을 입력하세요"},"contractVersion":"2.1.0","ruleSetVersion":"2.2.0-candidate","ruleId":"textarea-editable","contextHash":"0141a7016c45d8f35ab253353c5e474a740b38315bb7392896abf47df00fff89"},"children":[]},
      {"logicalNodeId":"qna-create/public","nodeType":"COMPONENT","type":"krds.checkbox","properties":{"semanticRole":"field.checkbox","label":"공개 여부","mode":"EDITABLE"},"componentResolution":{"role":"field.checkbox","logicalType":"krds.checkbox","componentSetKey":"68dac165ea6ccd639de85b07d6b49aadc0705d63","variantKey":"d08d126d452337d136243acf20c098b6bca708d8","variantProperties":{"Size":"medium","Check":"off","State":"default"},"componentProperties":{"label#309:0":"공개"},"contractVersion":"2.1.0","ruleSetVersion":"2.2.0-candidate","ruleId":"checkbox-editable","contextHash":"01669972cf915b44b66fb41d94dacf90312062e4346673e23c30a675a5688bc2"},"children":[]}
    ]}]},
    {"logicalNodeId":"qna-create/actions","nodeType":"SECTION","type":"egov.actionArea","properties":{},"children":[
      {"logicalNodeId":"qna-create/action/submit","nodeType":"COMPONENT","type":"krds.button","properties":{"semanticRole":"action.primary","label":"등록","state":"DEFAULT"},"componentResolution":{"role":"action.primary","logicalType":"krds.button","componentSetKey":"104d078e1895f788a91cfc8c42073fe6bc85e77a","variantKey":"e280ccbaae3e95099a298e208126f5abbff2f730","variantProperties":{"Type":"primary","Size":"medium","State":"default"},"componentProperties":{"Label#300:3":"등록"},"contractVersion":"2.1.0","ruleSetVersion":"2.2.0-candidate","ruleId":"action-primary","contextHash":"89791c2bdfde6464d99355cb17aa360a21faffbbf4b6b197d984036675827ba0"},"children":[]},
      {"logicalNodeId":"qna-create/action/cancel","nodeType":"COMPONENT","type":"krds.button","properties":{"semanticRole":"action.secondary","label":"취소","state":"DEFAULT"},"componentResolution":{"role":"action.secondary","logicalType":"krds.button","componentSetKey":"104d078e1895f788a91cfc8c42073fe6bc85e77a","variantKey":"189eeeae1c3236f83674729b1e2f6873e44e2386","variantProperties":{"Type":"secondary","Size":"medium","State":"default"},"componentProperties":{"Label#300:3":"취소"},"contractVersion":"2.1.0","ruleSetVersion":"2.2.0-candidate","ruleId":"action-secondary","contextHash":"c0d0396a985752ffd8e46e16b1d016404cc6a8610b5c4ef12f60f95c5a9cbaf2"},"children":[]}
    ]}
  ]},
  "issues":[],"semanticPattern":"crud.create","screenPatternVersion":"1.0.0","variantRuleSetVersion":"2.2.0-candidate","componentContractVersion":"2.1.0"
}
