{
  "screenId":"qna-answer-create","screenVersion":2,"screenSpecificationId":"qna-suite","screenSpecificationVersion":2,
  "screenType":"FORM","layoutPattern":"STANDARD","name":"답변 등록","route":"/qna/answers/new","viewport":"DESKTOP","status":"REVIEW_REQUIRED",
  "designSystem":{"profileId":"krds","profileVersion":"2.0.0","registryVersion":"2.1.0"},
  "content":{"logicalNodeId":"qna-answer-create","nodeType":"PAGE","type":"egov.formPage","properties":{},"children":[
    {"logicalNodeId":"qna-answer-create/header","nodeType":"COMPONENT","type":"krds.pageHeader","properties":{"semanticRole":"page.header","title":"답변 등록"},"componentResolution":{"role":"page.header","logicalType":"krds.pageHeader","componentSetKey":"18b8d3ffdbc9d4824e0d756e87a8f7af684ae980","variantKey":"18b8d3ffdbc9d4824e0d756e87a8f7af684ae980","variantProperties":{},"componentProperties":{"Title#259:4":"답변 등록"},"contractVersion":"2.1.0","ruleSetVersion":"2.0.0-candidate","ruleId":null,"contextHash":"b2f02a2a9013dc41bb8d82c37024a1eeff429306c8075e7765eb8a127521fd58"},"children":[]},
    {"logicalNodeId":"qna-answer-create/form-container","nodeType":"SECTION","type":"egov.formContainer","properties":{"semanticRole":"form.container"},"children":[
    {"logicalNodeId":"qna-answer-create/form","nodeType":"SECTION","type":"egov.formSection","properties":{"semanticRole":"form.section"},"children":[
      {"logicalNodeId":"qna-answer-create/question","nodeType":"COMPONENT","type":"krds.textField","properties":{"semanticRole":"field.text","label":"질문 제목","mode":"READ_ONLY"},"componentResolution":{"role":"field.text","logicalType":"krds.textField","componentSetKey":"e2643d821fe50580f30fd5d0378ad7e486543da6","variantKey":"70b0b3a31a84cc0ddc9e7e25fb820fed829dcb51","variantProperties":{"Size":"medium","State":"view"},"componentProperties":{"↪️Label#286:10":"질문 제목","Placeholder#286:9":"선택한 질문 제목"},"contractVersion":"2.1.0","ruleSetVersion":"2.0.0-candidate","ruleId":"text-readonly","contextHash":"b682150883085c8990a9992021c8446bd7f93cf447a1c6ee813ca4e33a046a40"},"children":[]},
      {"logicalNodeId":"qna-answer-create/writer","nodeType":"COMPONENT","type":"krds.textField","properties":{"semanticRole":"field.text","label":"답변자","mode":"EDITABLE"},"componentResolution":{"role":"field.text","logicalType":"krds.textField","componentSetKey":"e2643d821fe50580f30fd5d0378ad7e486543da6","variantKey":"f5e5a8b6e88dc45eb7357bd59c829c44bc47a198","variantProperties":{"Size":"medium","State":"default"},"componentProperties":{"↪️Label#286:10":"답변자","Placeholder#286:9":"답변자명을 입력하세요"},"contractVersion":"2.1.0","ruleSetVersion":"2.0.0-candidate","ruleId":"text-editable","contextHash":"70526a313d1f71c7e9833223ea55d8be9df66eba2c322b1cf35c87393113b773"},"children":[]},
      {"logicalNodeId":"qna-answer-create/status","nodeType":"COMPONENT","type":"krds.select","properties":{"semanticRole":"field.select","label":"처리 상태","mode":"EDITABLE"},"componentResolution":{"role":"field.select","logicalType":"krds.select","componentSetKey":"69ac27b250e29b249f408e70a7f72f6422206d66","variantKey":"6639d03b0d456bdec58887cc6432fc87a4b71d3d","variantProperties":{"Size":"medium","State":"default"},"componentProperties":{"↪️Label#286:10":"처리 상태","Placeholder#286:9":"상태를 선택하세요"},"contractVersion":"2.1.0","ruleSetVersion":"2.0.0-candidate","ruleId":"select-editable","contextHash":"51ba890e6c313d0ac9789a31ea3899100ad581f4907cc8abdb1ae6b31b1cdca0"},"children":[]},
      {"logicalNodeId":"qna-answer-create/answer","nodeType":"COMPONENT","type":"krds.textarea","properties":{"semanticRole":"field.textarea","label":"답변 내용","mode":"EDITABLE"},"componentResolution":{"role":"field.textarea","logicalType":"krds.textarea","componentSetKey":"f49c48fc96dc5454fa59f17cc937a87a9f986ba6","variantKey":"14b0380446ab18714fad10cfd534f5121db21961","variantProperties":{"State":"default"},"componentProperties":{"Label#286:10":"답변 내용","Placeholder#286:9":"답변 내용을 입력하세요"},"contractVersion":"2.1.0","ruleSetVersion":"2.0.0-candidate","ruleId":"textarea-editable","contextHash":"a72af2c075f2a7735f14b89a196c6493b8016d6aca93135d904189d8ba2d085e"},"children":[]}
    ]}]},
    {"logicalNodeId":"qna-answer-create/actions","nodeType":"SECTION","type":"egov.actionArea","properties":{},"children":[
      {"logicalNodeId":"qna-answer-create/action/submit","nodeType":"COMPONENT","type":"krds.button","properties":{"semanticRole":"action.primary","label":"등록","state":"DEFAULT"},"componentResolution":{"role":"action.primary","logicalType":"krds.button","componentSetKey":"104d078e1895f788a91cfc8c42073fe6bc85e77a","variantKey":"e280ccbaae3e95099a298e208126f5abbff2f730","variantProperties":{"Type":"primary","Size":"medium","State":"default"},"componentProperties":{"Label#300:3":"등록"},"contractVersion":"2.1.0","ruleSetVersion":"2.0.0-candidate","ruleId":"action-primary","contextHash":"bf08a4e815b1134bbf6e21f60618d9c4ebfaccd17c4e336283b5abe7bd2b2f52"},"children":[]},
      {"logicalNodeId":"qna-answer-create/action/cancel","nodeType":"COMPONENT","type":"krds.button","properties":{"semanticRole":"action.secondary","label":"취소","state":"DEFAULT"},"componentResolution":{"role":"action.secondary","logicalType":"krds.button","componentSetKey":"104d078e1895f788a91cfc8c42073fe6bc85e77a","variantKey":"189eeeae1c3236f83674729b1e2f6873e44e2386","variantProperties":{"Type":"secondary","Size":"medium","State":"default"},"componentProperties":{"Label#300:3":"취소"},"contractVersion":"2.1.0","ruleSetVersion":"2.0.0-candidate","ruleId":"action-secondary","contextHash":"925a363fef85a971181b936dfff016c2bffa01d5a1c2ad2381c598a8bd84326f"},"children":[]}
    ]}
  ]},
  "issues":[],"semanticPattern":"crud.create","screenPatternVersion":"1.0.0","variantRuleSetVersion":"2.0.0-candidate","componentContractVersion":"2.1.0"
}
